[
  {
    "$schema": "https://unperson-12359.github.io/trading-knowledge-library/schemas/research-result.schema.json",
    "schema_version": 1,
    "run_id": "atr-volatility-breakout-v1-hyperliquid-mainnet-btc-eth-15m-20260810T0259Z-b26563aa4e81",
    "created_at": "2026-08-10T03:02:14Z",
    "classification": "preliminary-limited-window-research",
    "status": "preliminary",
    "spec": {
      "id": "atr-volatility-breakout-v1",
      "version": 1,
      "sha256": "4d036ea5c6db61858aa380850ed09ce2d689beede7189cb2a0adc2b939071f8e",
      "path": "../../specs/atr-volatility-breakout-v1.json"
    },
    "dataset": {
      "id": "hyperliquid-mainnet-btc-eth-15m-20260810T0259Z",
      "sha256": "2cbb2246a498deaabb654f7faf43ba06237491f20ec640b3eadf67f301151253",
      "manifest_path": "../../datasets/hyperliquid-mainnet-btc-eth-15m-20260810T0259Z/dataset-manifest.json",
      "effective_start": 1781830800000,
      "effective_end": 1786330799999
    },
    "headline_scenario": 2.5,
    "scenarios": [
      {
        "slippage_bps": 0.0,
        "headline": false,
        "metrics": {
          "trade_count": 83,
          "gross_expectancy_r": -0.147971223,
          "net_expectancy_r": -0.4708167673,
          "win_rate": 0.2289156627,
          "median_r": -0.9562182171,
          "profit_factor": 0.3642734321,
          "maximum_drawdown_r": 39.077791689,
          "exposure_fraction": 0.0719,
          "fee_r": 26.5325317122,
          "slippage_r": 0.0,
          "funding_r": -0.2636484689,
          "long_short_split": {
            "long": {
              "trade_count": 49,
              "gross_expectancy_r": -0.0938312142,
              "net_expectancy_r": -0.4262656439,
              "win_rate": 0.2448979592,
              "median_r": -0.792872495,
              "profit_factor": 0.3755878963,
              "maximum_drawdown_r": 20.8870165524,
              "exposure_fraction": 0.0516,
              "fee_r": 15.924455199,
              "slippage_r": 0.0,
              "funding_r": -0.3648318587
            },
            "short": {
              "trade_count": 34,
              "gross_expectancy_r": -0.2259965298,
              "net_expectancy_r": -0.5350227981,
              "win_rate": 0.2058823529,
              "median_r": -1.0557789572,
              "profit_factor": 0.3507654807,
              "maximum_drawdown_r": 18.1907751365,
              "exposure_fraction": 0.0203,
              "fee_r": 10.6080765132,
              "slippage_r": 0.0,
              "funding_r": 0.1011833898
            }
          },
          "asset_split": {
            "BTC": {
              "trade_count": 41,
              "gross_expectancy_r": -0.149223536,
              "net_expectancy_r": -0.5274074052,
              "win_rate": 0.1951219512,
              "median_r": -0.816258398,
              "profit_factor": 0.3067895392,
              "maximum_drawdown_r": 21.6237036139,
              "exposure_fraction": 0.0688,
              "fee_r": 15.3660881287,
              "slippage_r": 0.0,
              "funding_r": -0.1394505087
            },
            "ETH": {
              "trade_count": 42,
              "gross_expectancy_r": -0.1467487269,
              "net_expectancy_r": -0.4155735256,
              "win_rate": 0.2619047619,
              "median_r": -0.9654315376,
              "profit_factor": 0.4234995951,
              "maximum_drawdown_r": 20.7899597981,
              "exposure_fraction": 0.075,
              "fee_r": 11.1664435835,
              "slippage_r": 0.0,
              "funding_r": -0.1241979601
            }
          },
          "holdout_start": 1785430799999,
          "holdout": {
            "trade_count": 26,
            "gross_expectancy_r": -0.2043893165,
            "net_expectancy_r": -0.6568555592,
            "win_rate": 0.1538461538,
            "median_r": -1.1084532415,
            "profit_factor": 0.2916511551,
            "maximum_drawdown_r": 17.0782445393,
            "exposure_fraction": 0.0905,
            "fee_r": 11.7171916035,
            "slippage_r": 0.0,
            "funding_r": -0.0469307058
          },
          "seven_day_segments": [
            {
              "trade_count": 7,
              "gross_expectancy_r": -0.4590756465,
              "net_expectancy_r": -0.7050980607,
              "win_rate": 0.1428571429,
              "median_r": -1.0367888135,
              "profit_factor": 0.0770032999,
              "maximum_drawdown_r": 5.3474583653,
              "exposure_fraction": 0.0230654762,
              "fee_r": 1.7241324732,
              "slippage_r": 0.0,
              "funding_r": 0.001975574,
              "start": 1781830800000,
              "end": 1782435599999
            },
            {
              "trade_count": 11,
              "gross_expectancy_r": -0.0431104898,
              "net_expectancy_r": -0.2391850732,
              "win_rate": 0.2727272727,
              "median_r": -0.9350479334,
              "profit_factor": 0.6366022747,
              "maximum_drawdown_r": 4.9885837219,
              "exposure_fraction": 0.0870535714,
              "fee_r": 2.1733019036,
              "slippage_r": 0.0,
              "funding_r": 0.0164814857,
              "start": 1782435600000,
              "end": 1783040399999
            },
            {
              "trade_count": 10,
              "gross_expectancy_r": 0.1058934149,
              "net_expectancy_r": -0.0917556017,
              "win_rate": 0.5,
              "median_r": -0.1680458388,
              "profit_factor": 0.8055690041,
              "maximum_drawdown_r": 2.6562612802,
              "exposure_fraction": 0.1063988095,
              "fee_r": 1.892116773,
              "slippage_r": 0.0,
              "funding_r": -0.0843733933,
              "start": 1783040400000,
              "end": 1783645199999
            },
            {
              "trade_count": 8,
              "gross_expectancy_r": 0.2643078683,
              "net_expectancy_r": -0.0290526098,
              "win_rate": 0.375,
              "median_r": -0.657073912,
              "profit_factor": 0.9508487128,
              "maximum_drawdown_r": 2.3961506703,
              "exposure_fraction": 0.0558035714,
              "fee_r": 2.2797475138,
              "slippage_r": 0.0,
              "funding_r": -0.0671363114,
              "start": 1783645200000,
              "end": 1784249999999
            },
            {
              "trade_count": 11,
              "gross_expectancy_r": -0.4317170843,
              "net_expectancy_r": -0.7220937487,
              "win_rate": 0.0909090909,
              "median_r": -0.9694157079,
              "profit_factor": 0.0915622509,
              "maximum_drawdown_r": 8.7436164378,
              "exposure_fraction": 0.037202381,
              "fee_r": 3.183658941,
              "slippage_r": 0.0,
              "funding_r": -0.0104843676,
              "start": 1784250000000,
              "end": 1784854799999
            },
            {
              "trade_count": 12,
              "gross_expectancy_r": -0.2989387474,
              "net_expectancy_r": -0.6360228828,
              "win_rate": 0.1666666667,
              "median_r": -0.7518115081,
              "profit_factor": 0.1398291204,
              "maximum_drawdown_r": 7.6322745938,
              "exposure_fraction": 0.0974702381,
              "fee_r": 3.9662225899,
              "slippage_r": 0.0,
              "funding_r": -0.0787870353,
              "start": 1784854800000,
              "end": 1785459599999
            },
            {
              "trade_count": 13,
              "gross_expectancy_r": -0.0632117058,
              "net_expectancy_r": -0.4210910934,
              "win_rate": 0.2307692308,
              "median_r": -1.1501997927,
              "profit_factor": 0.5140044731,
              "maximum_drawdown_r": 6.5887919161,
              "exposure_fraction": 0.0520833333,
              "fee_r": 4.6845647861,
              "slippage_r": 0.0,
              "funding_r": 0.0321327477,
              "start": 1785459600000,
              "end": 1786064399999
            },
            {
              "trade_count": 11,
              "gross_expectancy_r": -0.23721442,
              "net_expectancy_r": -0.84650932,
              "win_rate": 0.0909090909,
              "median_r": -1.0290268642,
              "profit_factor": 0.1176863856,
              "maximum_drawdown_r": 9.5330456369,
              "exposure_fraction": 0.1722972973,
              "fee_r": 6.6287867315,
              "slippage_r": 0.0,
              "funding_r": -0.0734571686,
              "start": 1786064400000,
              "end": 1786330799999
            }
          ]
        },
        "trade_log_path": null
      },
      {
        "slippage_bps": 2.5,
        "headline": true,
        "metrics": {
          "trade_count": 83,
          "gross_expectancy_r": -0.147971223,
          "net_expectancy_r": -0.6484106878,
          "win_rate": 0.2289156627,
          "median_r": -1.073779322,
          "profit_factor": 0.2680027379,
          "maximum_drawdown_r": 53.8180870846,
          "exposure_fraction": 0.0719,
          "fee_r": 26.5325317122,
          "slippage_r": 14.7402953956,
          "funding_r": -0.2636484689,
          "long_short_split": {
            "long": {
              "trade_count": 49,
              "gross_expectancy_r": -0.0938312142,
              "net_expectancy_r": -0.6068150226,
              "win_rate": 0.2448979592,
              "median_r": -1.0030004438,
              "profit_factor": 0.2696292377,
              "maximum_drawdown_r": 29.7339361074,
              "exposure_fraction": 0.0516,
              "fee_r": 15.924455199,
              "slippage_r": 8.846919555,
              "funding_r": -0.3648318587
            },
            "short": {
              "trade_count": 34,
              "gross_expectancy_r": -0.2259965298,
              "net_expectancy_r": -0.7083573817,